<?xml version="1.0" encoding="UTF-8"?>
<Almacen xmlns:xsi="http://www.w3.org/2001/XMLSchema-instance"
    xsi:noNamespaceSchemaLocation="file:/C:/Users/pagaliv/Documents/GitHub/practicas-PL/practica2/ejercicio2/AlmacenDif.xsd">
    
    <CD>
        <titulo></titulo>
        <numeroEj>3</numeroEj>
        <Discografica></Discografica>
    </CD>
    <Pelicula>
        <titulo></titulo>
        <numeroEj>34</numeroEj>
        <Origen></Origen>
        <estado_civil></estado_civil>
    </Pelicula>
</Almacen>